{
  "report_type": "worker",
  "subject_node_id": "PLACEHOLDER",
  "summary": "Unsupported claim",
  "information_delta": ["Concrete finite-check specialization proposal"],
  "claims": [
    {
      "id": "claim_unsupported",
      "text": "Goldbach is proved for all even integers.",
      "speculative": false
    }
  ],
  "proposed_objects": [],
  "proposed_links": [],
  "literature_refs": []
}
